{
  "schema_version": "1.0",
  "operation_id": "55555555-5555-4555-8555-555555555555",
  "kind": "checkpoint",
  "state": "completed",
  "revision": 7,
  "recording_id": "22222222-2222-4222-8222-222222222222",
  "session_id": "33333333-3333-4333-8333-333333333333",
  "branch": "main",
  "phase": "published",
  "cancel_requested": false,
  "result": {
    "checkpoint_id": "11111111-1111-4111-8111-111111111111",
    "anchor": {"branch": "main", "event_id": 142, "event_hash": "aaaaaaaaaaaaaaaaaaaaaaaaaaaaaaaaaaaaaaaaaaaaaaaaaaaaaaaaaaaaaaaa"}
  },
  "error": null
}
